{
  "$schema": "./schema.json",
  "version": "2.0.0",
  "lastUpdated": "2026-02-25T10:37:18.144Z",
  "plugins": [
    {
      "name": "@brika/blocks-builtin",
      "verifiedAt": "2026-01-17T00:00:00Z",
      "verifiedBy": "maintainer",
      "description": "Built-in blocks for Brika workflows",
      "tags": ["blocks", "official", "core"],
      "featured": true,
      "category": "official",
      "source": "npm",
      "signature": "8d72213890f0c01df6ff927b94fdf1711e6d3766ccdacbd6e1d264df12ccb6672b2e4a320e1c9f110508bf10913077e63b25504d459d30c7c0d4ed6256ec400f"
    },
    {
      "name": "@brika/plugin-spotify",
      "verifiedAt": "2026-02-23T00:00:00Z",
      "verifiedBy": "maintainer",
      "description": "Spotify Connect player for BRIKA dashboards",
      "tags": ["spotify", "music", "media", "integration"],
      "featured": true,
      "category": "official",
      "source": "npm",
      "signature": "95cfee5ea8e79bf5c45ae8bb0f2ffa8fb5d2d52c8568d19f9f1d32a7331d4d43fda6f3bf651ea7242cbdd9db3326a3b83ff8dc97320236e4deba838b60e73700"
    },
    {
      "name": "@brika/plugin-matter",
      "verifiedAt": "2026-02-23T00:00:00Z",
      "verifiedBy": "maintainer",
      "description": "Matter smart home device integration for BRIKA",
      "tags": ["matter", "smart-home", "iot", "integration"],
      "featured": true,
      "category": "official",
      "source": "npm",
      "signature": "f5f21113eb5dbfc6c9f9edf0a273cda5e0f0be70103c54b74609f59aa04c9968de0a1d6de4c695aa20de9623a238ef1845779bd9844ef342c9a676ceb52e8a03"
    }
  ],
  "publicKey": "ncl/idhhH3NPxm3Gy6Rjk9CZ3Cv4vBkze5sUFShYhnc=",
  "signature": "f0709b54edc3d678cb2b060eae68c88964766247e9e4098a9bfd5279dd6767d25708046f92df30f853fc9ca0002932602c73ad9b7d4eeac7329e2dcf6abebe06"
}
